{
  "slug": "2026-09-17-workshop-geodata-energienet",
  "titel": "Workshop geodata van het energienet",
  "start": "2026-09-17T13:00:00+02:00",
  "eind": "2026-09-17T16:30:00+02:00",
  "plaats": "Delft",
  "online": false,
  "organisator": "Voorbeeldorganisator",
  "url": "https://example.org/workshop-geodata",
  "thema": "geo",
  "beschrijving": "Voorbeeld-evenement dat al is geweest. Plaats, tijd en organisator zijn placeholders.",
  "zekerheid": "laag",
  "voorbeeld": true
}
