{
  "slug": "2026-11-05-webinar-energiesubsidies",
  "titel": "Webinar Energiesubsidies",
  "start": "2026-11-05T13:00:00+01:00",
  "eind": "2026-11-05T14:00:00+01:00",
  "plaats": "online",
  "online": true,
  "organisator": "CBS, met RVO en het Nationaal Programma Lokale Warmte",
  "url": "https://www.aanmelder.nl/179177",
  "thema": "verbruik",
  "beschrijving": "Toelichting op het bijgewerkte CBS-dashboard Energiesubsidies, dat het gebruik van energiesubsidies voor woningen vanaf 2021 laat zien. Sprekers van CBS, RVO en het NPLW bespreken wat er in het dashboard staat en hoe gemeenten de cijfers in beleid en uitvoering kunnen gebruiken. Gratis.",
  "zekerheid": "hoog"
}
