{
  "slug": "2026-11-24-smart-energy-day-5-0",
  "titel": "Smart Energy Day 5.0 — het laagspanningsnet onder hoge spanning",
  "start": "2026-11-24T13:00:00+01:00",
  "eind": "2026-11-24T17:00:00+01:00",
  "plaats": "Arnhem",
  "organisator": "Dutch Power, TKI Urban Energy, RVO en Connectr",
  "url": "https://www.dutchpower.net/eventagenda/smart-energy-dag-5-0",
  "thema": "net",
  "beschrijving": "Vijfde editie over het laagspanningsnet: hoe groot is de congestie op wijk- en straatniveau, en is er genoeg data om dat nu al te zeggen? Een van de blokken gaat over data en techniek. Vooraf, van 10:00 tot 12:00, een sessie over data delen en interoperabiliteit in woningen.",
  "zekerheid": "hoog"
}
