{
  "slug": "2026-12-01-digitalisering-energiesysteem-2026",
  "titel": "Digitalisering Energiesysteem 2026",
  "start": "2026-12-01T09:30:00+01:00",
  "eind": "2026-12-01T16:30:00+01:00",
  "plaats": "Hilversum",
  "organisator": "Energy Innovation NL, TNO en het ministerie van Economische Zaken en Klimaat",
  "url": "https://www.aanmelder.nl/digitaliseringenergiesysteem2026",
  "thema": "net",
  "beschrijving": "Congresdag over digitalisering van het energiesysteem. Sessies over meten en inzicht in het systeem, flexibiliteit van hoogspanning tot achter de meter, digitale weerbaarheid en open-source GIS voor energieplanning, plus een workshop over een energie-data-ecosysteem. Gratis deelname.",
  "zekerheid": "midden"
}
