{
  "slug": "2026-10-22-meetup-datavisualisatie-energie",
  "titel": "Meetup datavisualisatie energie",
  "start": "2026-10-22T18:30:00+02:00",
  "eind": "2026-10-22T21:00:00+02:00",
  "plaats": "Utrecht",
  "online": false,
  "organisator": "Voorbeeldorganisator",
  "url": "https://example.org/meetup-datavisualisatie",
  "thema": "verbruik",
  "beschrijving": "Voorbeeld-evenement. Plaats, tijd en organisator zijn placeholders.",
  "zekerheid": "laag",
  "voorbeeld": true
}
