{
  "slug": "2026-12-01-vivet-netwerkbijeenkomst",
  "titel": "VIVET-netwerkbijeenkomst",
  "start": "2026-12-01T13:00:00+01:00",
  "eind": "2026-12-01T18:00:00+01:00",
  "plaats": "Utrecht",
  "organisator": "Programma VIVET",
  "url": "https://www.programmavivet.nl/agenda/3281150.aspx?t=Netwerkbijeenkomst+VIVET+",
  "thema": "net",
  "beschrijving": "Netwerkmiddag over data en digitalisering in de energietransitie, met een keynote van EZK en keuzesessies over data als gereedschap voor gemeenten, het elektriciteitsnet in beeld, semantische standaardisatie van data-uitwisseling en netcongestie. Aanmelden is gesloten: het maximum is bereikt.",
  "zekerheid": "hoog"
}
